{
  "name": "atomic-emacs",
  "main": "./lib/atomic-emacs",
  "version": "0.4.0",
  "description": "An atomic implementation of emacs keybindings",
  "activationEvents": [
    "atomic-emacs:beginning-of-buffer",
    "atomic-emacs:end-of-buffer",
    "atomic-emacs:back-to-indentation",
    "atomic-emacs:upcase-region",
    "atomic-emacs:downcase-region",
    "atomic-emacs:open-line",
    "atomic-emacs:transpose-chars",
    "atomic-emacs:transpose-words",
    "atomic-emacs:transpose-lines",
    "atomic-emacs:set-mark",
    "atomic-emacs:remove-mark",
    "atomic-emacs:mark-whole-buffer",
    "atomic-emacs:exchange-point-and-mark",
    "atomic-emacs:copy",
    "atomic-emacs:kill-region",
    "atomic-emacs:forward-char",
    "atomic-emacs:backward-char",
    "atomic-emacs:forward-word",
    "atomic-emacs:backward-word",
    "atomic-emacs:next-line",
    "atomic-emacs:previous-line",
    "atomic-emacs:move-beginning-of-line",
    "atomic-emacs:move-end-of-line",
    "atomic-emacs:scroll-up",
    "atomic-emacs:scroll-down",
    "atomic-emacs:recenter-top-bottom",
    "atomic-emacs:just-one-space",
    "atomic-emacs:delete-horizontal-space",
    "atomic-emacs:backward-paragraph",
    "atomic-emacs:forward-paragraph"
  ],
  "repository": {
    "type": "git",
    "url": "https://github.com/avendael/atomic-emacs"
  },
  "license": "MIT",
  "engines": {
    "atom": ">0.50.0"
  },
  "dependencies": {},
  "readme": "## Atomic Emacs\n\nAn atomic implementation of emacs keybindings.\n![Build Status](https://travis-ci.org/avendael/atomic-emacs.svg?branch=master)\n\n### Important Note\n\nI love emacs, but this package will never implement all of emacs' features. It only aims to\nprovide a reasonable set of default emacs keybindings so that emacs refugees might find themselves\nat home.\n\nOSX already provides emacs-like keybindings to Atom, and those are not reimplemented in this\npackage. This might, however, cause a problem later on when Atom becomes available at other\nplatforms. Once that time comes, I will gladly include those keybindings in this package.\n\n### Current Status\n\nIt's super incomplete, very alpha stage. Basically, just these:\n\n* 'ctrl-f': 'atomic-emacs:forward-char'\n* 'ctrl-b': 'atomic-emacs:backward-char'\n* 'ctrl-n': 'atomic-emacs:next-line'\n* 'ctrl-p': 'atomic-emacs:previous-line'\n* 'ctrl-a': 'atomic-emacs:move-beginning-of-line'\n* 'ctrl-e': 'atomic-emacs:move-end-of-line'\n* 'ctrl-l': 'atomic-emacs:recenter-top-bottom'\n* 'ctrl-g': 'atomic-emacs:remove-mark'\n* 'ctrl-k': 'editor:cut-to-end-of-line'\n* 'ctrl-y': 'core:paste'\n* 'ctrl-w': 'atomic-emacs:kill-region'\n* 'ctrl-v': 'atomic-emacs:scroll-up'\n* 'ctrl-s': 'find-and-replace:show'\n* 'ctrl-r': 'find-and-replace:show'\n* 'ctrl-j': 'editor:newline'\n* 'ctrl-/': 'core:undo'\n* 'ctrl-o': 'atomic-emacs:open-line'\n* 'ctrl-t': 'atomic-emacs:transpose-chars'\n* 'ctrl-_': 'core:undo'\n* 'ctrl-space': 'atomic-emacs:set-mark'\n* 'ctrl-x ctrl-s': 'core:save'\n* 'ctrl-x ctrl-u': 'atomic-emacs:upcase-region'\n* 'ctrl-x ctrl-l': 'atomic-emacs:downcase-region'\n* 'ctrl-x ctrl-t': 'atomic-emacs:transpose-lines'\n* 'ctrl-x h': 'atomic-emacs:mark-whole-buffer'\n* 'ctrl-x ctrl-x': 'atomic-emacs:exchange-point-and-mark'\n* 'alt-f': 'atomic-emacs:forward-word'\n* 'alt-b': 'atomic-emacs:backward-word'\n* 'alt-q': 'autoflow:reflow-selection'\n* 'atl-t': 'atomic-emacs:transpose-words'\n* 'alt-w': 'atomic-emacs:copy'\n* 'alt-;': 'editor:toggle-line-comments'\n* 'alt-v': 'atomic-emacs:scroll-down'\n* 'alt-<': 'atomic-emacs:beginning-of-buffer'\n* 'alt->': 'atomic-emacs:end-of-buffer'\n* 'alt-m': 'atomic-emacs:back-to-indentation'\n* 'alt-/': 'autocomplete:toggle'\n* 'alt-.': 'symbols-view:toggle-file-symbols'\n* 'alt-\\\\': 'atomic-emacs:delete-horizontal-space'\n* 'alt-space': 'atomic-emacs:just-one-space'\n* 'alt-{': 'atomic-emacs:backward-paragraph'\n* 'alt-}': 'atomic-emacs:forward-paragraph'\n\n#### Some things that might not work as expected\n\nThere is a set-marks command. However, the ctrl-space mapping is being used by atom-core, and this package cannot override the core mappings. To use this command, the user must include the following lines in the user's keymap.cson (accessed through menu Atom -> Open Your Keymap):\n\n```\n'.editor':\n  'ctrl-space': 'atomic-emacs:set-mark'\n```\n\nThere is also a known issue that suddenly borks the keybindings. Please check issue [#17](https://github.com/avendael/atomic-emacs/issues/17) for the workaround.\n\n### Future Work\n\nVersion 1.0.0 should be somewhat close to what [sublemacspro](https://github.com/grundprinzip/sublemacspro) currently has as of time of writing (03/04/14), and then improve further based on that. Next up are:\n\n* Kill ring\n* Macros\n* Motion commands for other platforms (OSX has the basic emacs motion commands by default)\n\n### Contributing\n\nYes please!\n",
  "readmeFilename": "README.md",
  "bugs": {
    "url": "https://github.com/avendael/atomic-emacs/issues"
  },
  "homepage": "https://github.com/avendael/atomic-emacs",
  "_id": "atomic-emacs@0.4.0",
  "_shasum": "25c6bb6402bc5c4526ff838b2061fa4f1fcc86d0",
  "_resolved": "file:../d-11514-1379-k8s21b/package.tgz",
  "_from": "../d-11514-1379-k8s21b/package.tgz",
  "_atomModuleCache": {
    "version": 1,
    "dependencies": [],
    "extensions": {
      ".coffee": [
        "lib/atomic-emacs.coffee",
        "lib/cursor-tools.coffee",
        "lib/mark.coffee"
      ],
      ".json": [
        "package.json"
      ]
    },
    "folders": []
  }
}